{
   "title": "Varying Density in a Truncated Cone",
   "icon_data": {
      "difficulty": 3,
      "par_time": [
         20,
         30
      ],
      "statement": ""
   },
   "master_statement": "Using the geometries of the previous question, calculate the mass of the fluid if the fluid density varies linearly according to \\(\\rho(z)=\\rho_{0}-a z\\)",
   "media": [
      "TruncatedCone.png"
   ],
   "parts": [
      {
         "statement": "",
         "response": {
            "mode": "Non Permuting Multiple Choice",
            "answer": 3,
            "choices": [
               "<p>\\(W=\\frac{1}{3} \\rho_{0} g \\pi h\\left\\{\\left(R_{t}+R_{0}\\right)^{2}-R_{t} R_{0}\\right\\}+\\frac{1}{4} \\operatorname{ag\\pi h}^{2}\\left\\{\\left(R_{t}+R_{0}\\right)^{2}+\\frac{2}{3}\\left(R_{t} R_{0}+R_{0}^{2}\\right)\\right\\}\\)</p>",
               "<p>\\(W=\\frac{1}{4} \\operatorname{ag\\pi h}^{2}\\left\\{\\frac{2}{3}\\left(R_{t} R_{0}+R_{0}^{2}\\right)-\\left(R_{t}+R_{0}\\right)^{2}\\right\\}-\\frac{1}{3} \\rho_{0} g \\pi h\\left\\{\\left(R_{t}+R_{0}\\right)^{2}-R_{t} R_{0}\\right\\}\\)</p>",
               "<p>\\(W=\\frac{1}{3} \\rho_{0} g \\pi h\\left\\{\\left(R_{t}+R_{0}\\right)^{2}-R_{t} R_{0}\\right\\}-\\frac{1}{4} \\operatorname{ag\\pi h}^{2}\\left\\{\\left(R_{t}+R_{0}\\right)^{2}-\\frac{2}{3}\\left(R_{t} R_{0}+R_{0}^{2}\\right)\\right\\}\\)</p>",
               "<p>\\(W=\\frac{1}{4} \\operatorname{ag\\pi h}^{2}\\left\\{\\left(R_{t}+R_{0}\\right)^{2}-\\frac{2}{3}\\left(R_{t} R_{0}+R_{0}^{2}\\right)\\right\\}-\\frac{1}{3} \\rho_{0} g \\pi h\\left\\{\\left(R_{t}+R_{0}\\right)^{2}-R_{t} R_{0}\\right\\}\\)</p>"
            ]
         },
         "final_answer": {
            "text": "\\(W=\\frac{1}{3} \\rho_{0} g \\pi h\\left\\{\\left(R_{t}+R_{0}\\right)^{2}-R_{t} R_{0}\\right\\}-\\frac{1}{4} \\operatorname{ag\\pi h}^{2}\\left\\{\\left(R_{t}+R_{0}\\right)^{2}-\\frac{2}{3}\\left(R_{t} R_{0}+R_{0}^{2}\\right)\\right\\}\\)"
         },
         "worked_solutions": [
            {
               "text": "If the density of the fluid varies linearly according to : <br>\\(\\rho(z)=\\rho_{0}-a z\\)"
            },
            {
               "text": "The weight of the fluid is given as: <br>\\(\\begin{aligned}W &=\\int_{0}^{h}\\left(\\rho_{0}-a z\\right) g \\pi\\left\\{\\frac{R_{t}-R_{0}}{h} z+R_{0}\\right\\}^{2} d z \\\\&=\\rho_{0} g \\pi \\int_{0}^{h}\\left\\{\\left(\\frac{R_{t}-R_{0}}{h}\\right)^{2} z^{2}+2 \\frac{R_{0}}{h}\\left(R_{t}-R_{0}\\right) z+R_{0}^{2}\\right\\} d z\\\\&-a g \\pi \\int_{0}^{h}\\left\\{\\left(\\frac{R_{t}-R_{0}}{h}\\right)^{2} z^{3}+2 \\frac{R_{0}}{h}\\left(R_{t}-R_{0}\\right) z^{2}+R_{0}^{2} z\\right\\} d z\\\\&=\\rho_{0} g \\pi\\left\\{\\left(\\frac{R_{t}-R_{0}}{h}\\right)^{2} \\frac{1}{3} z^{3}+\\frac{R_{0}}{h}\\left(R_{t}-R_{0}\\right) z^{2}+\\left.R_{0}^{2} z\\right|_{0} ^{h}\\right\\}\\&-a g \\pi\\left\\{\\frac{1}{4}\\left(\\frac{R_{t}-R_{0}}{h}\\right)^{2} z^{4}+\\frac{2}{3} \\frac{R_{0}}{h}\\left(R_{t}-R_{0}\\right) z^{3}+\\left.\\frac{R_{0}^{2}}{2} z^{2}\\right|_{0} ^{h}\\right\\}\\&W=\\rho_{0} g \\pi h\\left\\{\\frac{1}{3} R_{t}^{2}+\\frac{1}{3} R_{t} R_{0}+\\frac{1}{3} R_{0}^{2}\\right\\}-a g \\pi h^{2}\\left\\{\\frac{1}{4} R_{t}^{2}+\\frac{1}{6} R_{t} R_{0}+\\frac{1}{12} R_{0}^{2}\\right\\}\\end{aligned}\\)"
            },
            {
               "is_final_answer": true
            }
         ]
      }
   ],
   "uid": "fd7a8638-fcfe-42f1-a591-5690cc832ebf"
}