{
    "title": "Numerical-20260408_220141",
    "uid": "59320b45-5b9d-4768-bd09-8ff784864ac5",
    "master_statement": "What is the gravitational acceleration on Earth in m/s^2?",
    "parts": [
        {
            "statement": "",
            "response": {
                "mode": "Numeric",
                "name": "sro_id_1",
                "answer": {
                    "num": "9.81",
                    "units": ""
                },
                "grading": "toler_abs",
                "err": 0.01,
                "showUnits": false,
                "negStyle": "minus",
                "numStyle": "thousands scientific  arithmetic",
                "comment": ""
            }
        }
    ]
}