{
   "title": "Volume and Mass of Truncated Cone",
   "icon_data": {
      "difficulty": 3,
      "par_time": [
         15,
         20
      ],
      "statement": ""
   },
   "master_statement": "Using volume integrals, determine the volume and mass of a fluid of constant density \\(\\rho\\) in the following container filled up to the top. Determine the integrals by summing thin slices of height d\\(z\\) over the \\(z\\)-direction.",
   "media": [
      "TruncatedCone.png"
   ],
   "parts": [
      {
         "statement": "The truncated cone:",
         "custom_response": {
            "layout": "<table><tr><td><span>\\(m=\\)</span></td><td><div class=\"inline-resp\"><1></div></td><td><span>\\(\\{ \\frac{1}{3} \\pi \\)</span></td><td><div class=\"inline-resp\"><2></div></td><td><span>\\(^{2}h+\\frac{1}{3} \\pi h R_{t} \\)</span></td><td><div class=\"inline-resp\"><3></div></td><td><span>\\(+\\frac{1}{3} \\pi \\)</span></td><td><div class=\"inline-resp\"><4></div></td><td><span>\\(R_{t}^{2}\\}\\)</span></td><tr></table><style media=\"screen\"> .inline-resp { padding: 2px; width: 50px; } .inline-resp .select2 { width: 50px; height: 25px; } .inline-resp .select2-container--bootstrap .select2-selection--single { padding: 3px 24px 3px 6px; }</style><script type=\"text/javascript\"> /* We need to change the widths of the dropdown lists */ jQuery(document).ready(function() { jQuery(\".doInPreview, .doInSession\").click(function () { jQuery(\".part.active .dropdowns .inline-resp .response\").css(\"width\", \"52px\"); console.log(this); });});</script>",
            "responses": [
               {
                  "mode": "List",
                  "answers": [
                     "\\(R_{0}\\)",
                     "\\(R_{t}\\)",
                     "\\(h\\)",
                     "\\(\\pi\\)",
                     "\\(\\rho\\)"
                  ],
                  "credits": [
                     0,
                     0,
                     0,
                     0,
                     1
                  ]
               },
               {
                  "mode": "List",
                  "answers": [
                     "\\(R_{0}\\)",
                     "\\(R_{t}\\)",
                     "\\(h\\)",
                     "\\(\\pi\\)",
                     "\\(\\rho\\)"
                  ],
                  "credits": [
                     1,
                     0,
                     0,
                     0,
                     0
                  ]
               },
               {
                  "mode": "List",
                  "answers": [
                     "\\(R_{0}\\)",
                     "\\(R_{t}\\)",
                     "\\(h\\)",
                     "\\(\\pi\\)",
                     "\\(\\rho\\)"
                  ],
                  "credits": [
                     1,
                     0,
                     0,
                     0,
                     0
                  ]
               },
               {
                  "mode": "List",
                  "answers": [
                     "\\(R_{0}\\)",
                     "\\(R_{t}\\)",
                     "\\(h\\)",
                     "\\(\\pi\\)",
                     "\\(\\rho\\)"
                  ],
                  "credits": [
                     0,
                     0,
                     1,
                     0,
                     0
                  ]
               }
            ]
         },
         "final_answer": {
            "text": "\\(V=\\frac{1}{3} \\pi R_{t}^{2}\\left\\{h+\\frac{h R_{0}}{R_{t}-R_{0}}\\right\\}-\\frac{1}{3} \\pi R_{0}^{2}\\left\\{\\frac{h}{R t-R_{i}}\\right\\} \\\\ m=\\rho\\left\\{\\frac{1}{3} \\pi R_{0}{ }^{2} h+\\frac{1}{3} \\pi h R_{t} R_{0}+\\frac{1}{3} \\pi h R_{t}^{2}\\right\\}\\)"
         },
         "worked_solutions": [
            {
               "text": "Again consider a horizontal slice of thickness \\(dz\\). An element of volume is given by:<br>\\(dV=\\pi R(z)^{2}dz\\)"
            },
            {
               "text": "To find R(z) we use that \\(R(0)=R_{0}\\) and \\(R(h)=R_{t}\\) and the fact that R(z) grows linearly, implying that:<br>\\(R(z)=R_{0}+\\frac{R_{t}-R_{0}}{h} z\\)"
            },
            {
               "text": "The volume can be determined by:<br>\\(\\begin{aligned}V &=\\pi \\int_{0}^{h}\\left\\{\\frac{R_{t}-R_{0}}{h} z+R_{0} \\right\\}^{2} d z \\\\&=\\pi \\int_{0}^{h}\\left\\{\\left(\\frac{R_{t}-R_{0}}{h}\\right)^{2} z^{2}+2 \\frac{R_{0}}{h}\\left(R_{t}-R_{0}\\right) z+R_{0}^{2}\\right\\} d z \\\\&=\\pi\\left\\{\\frac{1}{3}\\left(\\frac{R_{t}-R_{0}}{h}\\right)^{2} z^{3}+\\frac{R_{0}}{h}\\left(R_{t}-R_{0}\\right) z^{2}+\\left.R_{0}^{2} z\\right|_{0} ^{h}\\right\\} \\\\V &=\\frac{1}{3} \\pi R_{0}^{2} h+\\frac{1}{3} \\pi h R_{t} R_{0}+\\frac{1}{3} \\pi h R_{t}^{2} \\quad \\cdots \\quad E q .(3)\\end{aligned}\\)"
            },
            {
               "text": "Multiplying Eq(3) with \\(\\frac{R_{t}-R_{0}}{R_{t}-R_{0}}\\) gives us a different form of the equation:<br>\\(\\begin{aligned}&V=\\frac{1}{3} \\pi R_{t}^{2} h\\left(\\frac{R_{t}}{R_{t-} R_{0}}\\right)-\\frac{1}{3} \\pi R_{0}^{2} h\\left(\\frac{R_{0}}{R_{t}-R_{0}}\\right) \\\\&V=\\frac{1}{3} \\pi R_{t}^{2}\\left\\{h+\\frac{h R_{0}}{R_{t}-R_{0}}\\right\\}-\\frac{1}{3} \\pi R_{0}^{3}\\left\\{\\frac{h}{R_{t}-R_{0}}\\right\\} \\quad \\cdots \\quad E q .(4)\\end{aligned}\\)"
            },
            {
               "text": "This equation (4) is equivalent to the subtraction of volume of cone 1 with volume of cone 2<br>\\(\\begin{aligned}&V_{\\text {cone } 1}=\\int_{-h^{*}}^{h^{*}+h} \\pi R(z)^{2} d z \\\\&V_{\\text {cone } 2}=\\int_{-h^{*}}^{0} \\pi R(z)^{2} d z, \\text { where } h^{*}=\\frac{h R_{0}}{R_{t}-R_{0}}\\end{aligned}\\)"
            },
			{
				"media": [
					"TruncatedConeAnswer01.png"
				]
			},
            {
               "text": "In the same way to determine the mass of the fluid in the container of problem 6a and as the density of the fluid is constant, the mass is given by:<br>\\(m=\\rho \\int d v\\)"
            },
            {
               "text": "\\(m=\\rho\\left\\{\\frac{1}{3} \\pi R_{0}{ }^{2} h+\\frac{1}{3} \\pi h R_{t} R_{0}+\\frac{1}{3} \\pi h R_{t}^{2}\\right\\}\\)"
            }
         ]
      }
   ],
   "uid": "dba7bfee-272f-40f3-8ad6-adcbcfa4c8cc"
}