{
   "title": "Varying Density in a Triangular Prism",
   "icon_data": {
      "difficulty": 3,
      "par_time": [
         10,
         15
      ],
      "statement": ""
   },
   "master_statement": "Using the geometries of the previous question, calculate the mass of the fluid if the fluid density varies linearly according to \\(\\rho(z)=\\rho_{0}-a z\\)",
   "media": [
      "TriangularPrism.png"
   ],
   "parts": [
      {
         "statement": "",
         "response": {
            "mode": "Non Permuting Multiple Choice",
            "answer": 1,
            "choices": [
               "<p>\\(W=g w b h\\left\\{\\frac{1}{2} \\rho_{0}-\\frac{a}{3} h\\right\\}\\)</p>",
               "<p>\\(W=g w b h\\left\\{\\frac{a}{3} h-\\frac{1}{2} \\rho_{0}\\right\\}\\)</p>",
               "<p>\\(W=g w b h\\left\\{\\frac{a}{3} \\rho_{0}-\\frac{1}{2} h\\right\\}\\)</p>"
            ]
         },
         "final_answer": {
            "text": "\\(W=g w b h\\left\\{\\frac{1}{2} \\rho_{0}-\\frac{a}{3} h\\right\\}\\)"
         },
         "worked_solutions": [
            {
               "text": "If the density of the fluid varies linearly according to : <br> \\(\\rho(z)=\\rho_{0}-a z\\)"
            },
            {
               "text": "The weight of the fluid in the container is given as: <br> \\(\\begin{aligned}W &=\\int \\rho(z) g d V \\\\&=\\int_{0}^{h}\\left(\\rho_{0}-a z\\right) g \\frac{b w}{h} z d z \\\\&= g w b h \\left\\{\\frac{1}{2} \\rho_{0} z^{2}-\\left.\\frac{a}{3} z^{3}\\right|_{0} ^{h}\\right\\} \\\\W &=g w b h\\left\\{\\frac{1}{2} \\rho_{0}-\\frac{a}{3} h\\right\\} \\text { where a is the gravitational acceleration }\\end{aligned}\\)"
            },
            {
               "is_final_answer": true
            }
         ]
      }
   ],
   "uid": "5549aaf0-3deb-4b8d-b447-4120d037291c"
}